,title,type
3010,xml.dom.minidom: performance issue with Node.insertBefore(),7
3012,Implement socket.sendmsg() for Windows,6
3013,mock.patch decorating a generator returns a regular function.,5
3014,let code force str(bytes) to raise an exception,6
3015,Misleading documentation for __prepare__,5
3017,string.Formatter does not support key/attribute access on unnumbered fields,5
3018,"subprocess.run(cmd, input='text') should pass universal_newlines=True to Popen",6
3019,A manager's server never joins its threads,5
3020,urllib2 maybe blocks too long with small chunks,5
3022,pysqlite3 context manager not performing rollback when a database is locked elsewhere for non-DML statements,5
3023,email header indentation destroyed,5
3024,get_addresses results in traceback with an addrspec with an empty local part.,5
3025,Skip callables when displaying exception fields in cgitb,6
3026,Add memfd_create to os module,6
3027,Document behavior when CDLL is called  with None as an argument on POSIX systems,6
3029,SIGSEV in test_window_funcs of test_curses,1
3030,asyncio documentation links to wrong CancelledError,6
3031,Allow `install_headers` command to follow specific directory structure,6
3032,Handling data_files: too much is removed in uninstall,5
3035,"Tkinter sets the HOME environment variable, breaking scripts",5
3036,Cannot compile with /fp:strict with MSVC,2
3037,distutils' Command.ensure_dirname fails on Unicode,5
3038,ctypes (libffi) fails to compile on Solaris X86,2
3039,[argparse] Unify options in help output,6
3040,close() behavior on non-blocking BufferedIO objects with sockets,5
3041,IDLE shutdown glitch when started by import,5
3042,"""universal newlines"" subprocess support broken with select- and poll-based communicate()",5
3043,tempfile.TemporaryFile(): missing errors=... argument,6
3044,XML vulnerabilities in Python,4
3045,xml.sax and xml.dom fetch DTDs by default,3
3046,Patches for thread-support in built-in SHA modules,7
3047,Add file-sealing ops to fcntl,6
3048,subprocess.Popen.communicate: accept str for input parameter if universal_newlines is False,6
3049,Fatal Python error: Segmentation fault in test_exceptions,1
3050,[ctypes] Add value attribute to non basic pointers.,6
3051,Add support for retrieving the certificate chain,6
3053,IPv6Network constructor docs incorrect about valid input,5
3054,unpickling an xmlrpc.client.Fault raises TypeError,5
3055,ctypes incorrectly encodes .format attribute of memory views,5
3056,Implement equivalent to `pip.locations.distutils_scheme` in distutils,6
3057,Missing equality check for super objects,6
3058,io.BytesIO.truncate does not work as advertised,5
3059,sched.py: speedup cancel() method,7
3060,Possible missing deprecation warnings?,6
3061,Steps for Android Native Build of Python 3.4.2,6
3062,equivalent functools.partial instances should compare equal,6
3063,IDLE: problems with dark GTK or KDE color schemes,5
3064,Compilation of python (modules) for foreign target platform problem.,2
3065,Expand zipimport to include other compression methods,6
3066,__all__ lists are incomplete,6
3067,Idle: improve stack viewer,5
3068,mingw: init system calls,6
3069,"os.path.normpath(""//"") returns //",5
3070,cannot jump from a return after setting f_lineno,1
3071,turtle.fillcolor doesn't accept a tuple of floats,6
3073,improve tracing performance with f_trace set to Py_None,6
3074,Make Profile.print_stats support sorting by mutiple values,6
3075,pdb continue followed by an exception in the same frame shows incorrect frame linenumber,5
3076,Avoid entity expansion attacks in Element Tree,4
3077,locale.nl_langinfo() can't decode value,5
3078,"mock.patch interactions with ""from"" imports",5
3079,long_add and long_sub might return a new int where &small_ints[x] could be returned,5
3080,memoryview() constructor documentation error,5
3081,IDLE to support reindent.py,6
3082,Crash when RawIOBase.write(b) evaluates b.format,1
3083,Update pep8 to specify explicitly 'module level' imports at top of file,6
3084,Link Time Optimizations support for GCC and CLANG,7
3085,Add HTTP Response code 451,6
3086,configure --with-lto with clang should find the appropriate llvm-profdata tool,2
3088,Stop using deprecated imp module; imp should now emit a real DeprecationWarning,6
3089,Invalid 'line' tracer event on pass within else clause,5
3090,Verifying refcounts.dat,5
3091,Make libedit support more generic; port readline / libedit to FreeBSD,6
3093,Add 'm' format specifier for mon_grouping etc.,6
3094,Unpickling Path objects,5
3095,str.splitlines splitting on non-\r\n characters,5
3096,Possibly ambiguous phrasing in tutorial/modules#more-on-modules,5
3098,asyncio reference cycles after ConnectionResetError,3
3099,Regression in file.writelines behavior,5
3100,"PEP446 (CLOEXEC by default) violation with fcntl.fcntl(..., fcntl.F_DUPFD)",5
3101,distutils docs: data_files always uses sys.prefix,5
3102,Should str.format allow negative indexes when used for __getitem__ access?,6
3103,New assert method that checks an error message for a list of strings,6
3104,imghdr does not support jpg files with Lavc bytes,5
3105,Add truncated SHA512/224 and SHA512/256,6
3106,Rename the posix module to _os,6
3107,remove/delete method for zipfile/tarfile objects,6
3108,Remove deprecated html.parser.HTMLParser.unescape(),6
3109,`compile` doesn't compile into an AST object as specified,5
3110,Readline completion of module names in import statements,6
3113,Add closefd argument to os.listdir,6
3114,Improve curses tests,6
3116,Add dir_fd and follow_symlinks kwargs to os.listdir and os.scandir,6
3117,socket.sendall() cannot send buffers of 2GB or more,5
3118,Confusing text about __all__ in __init__.py in tutorial,6
3119,"Make test.script_helper more comprehensive, and use it in the test suite",6
3120,Make pkgutil.iter_modules() yield built-in modules,6
3121,unicode.decode and str.encode are unnecessarily confusing for non-ascii,5
3122,Clarify how to use various import-related locks,6
3123,`inspect` doesn't have `__all__`,5
3124,argparse only supports iterable choices,5
3125,PyBuffer_SizeFromFormat is missing,6
3126,"Universal newline support for zipFile.ZipExtFile.read() is not working (deprecated?), and the missing functionality not documented",5
3127,Poor performance when reading large xmlrpc data,7
3128,Mark up of references in different form,6
3129,%Z in strptime doesn't match EST and others,5
3130,expose sendmmsg() syscall  in sockets API,6
3131,Arithmetics with complex infinities is inconsistent with C/C++,6
3132,Undocumented different between METH_KEYWORDS and **kws,5
3133,Python on 64-bit Windows uses signed 32-bit type for read length,5
3134,os.writev() does not accept generators (as buffers argument),5
3135,sys.path in tests contains system directories,5
3136,test_curses skipped on buildbots,5
3137,datetime.datetime.replace bypasses a subclass's __new__,5
3138,Disabling logging to ~/.python_history is not simple enough,6
3139,Unexpected call to readline's add_history in call_readline,5
3140,BlockingIOError not raised inside function.,5
3141,async/await keywords are missing from reference docs,6
3142,Curses terminal resize problems when Python is in interactive mode,5
3143,bitwise ops for bytes of equal length,6
3146,Document select() failure with buffered file,5
3147,RSS and Atom feeds of buildbot results are broken,5
3148,"subprocess.CalledProcessError's repr changes based on kwargs, and doesn't unpickle",5
3149,64-bit Python 2.7.11 hangs in 64-bit Windows 10 - CMD and Git Bash,1
3150,Tab-completion of callables displays opening paren,5
3151,rlcompleter.Completer matches too much,5
3152,doctest should allow custom sys.displayhook,5
3155,Support different modes in posixpath.realpath(),6
3156,distutils crashes when uploading to PyPI having only the username (no pw) defined,1
3157,Docs for pdb should note that __future__ magic doesn't work,6
3158,doctest terminates when accessing __wrapped__ raises an error,5
3159,tokenize yield an ERRORTOKEN if an identifier uses Other_ID_Start or Other_ID_Continue,5
3161,argparse: allow_abbrev=False stops -vv from working,5
3162,argparse help formatter crashes,1
3164,The danger of PyType_FromSpec(),4
3165,Implement pathlib.Path.link (Using os.link),6
3166,The tarfile module crashes when tarfile contains a symlink and unpack directory contain it too,1
3167,Document that ctypes.xFUNCTYPE are decorators.,6
3168,optparse module does not emit DeprecationWarning,5
3170,urllib.parse.urlparse accepts any falsy value as an url,5
3171,wsgiref.simple_server sends headers on empty bytes,5
3172,No-argument super in method with variable arguments raises SystemError,5
3174,"expose name, args, and kwargs from methodcaller",6
3175,glob.glob incorrect results under windows when pathname exists but interpreter does not have access permissions to pathname,5
3176,classmethod doesn't honour descriptor protocol of wrapped callable,6
3178,Unintuitive error when using generator expression in class property,5
3180,ExtendedInterpolation drops user-defined 'vars' during _interpolate_some() recursion,5
3181,unicodedata.normalize(): bug in Hangul Composition,5
3182,`help` ignores `__doc__` of descriptors,5
3183,"setup.py --quiet doesn't silence ""no previously-included directories"" warnings from MANIFEST.in",5
3184,Multiple memory leaks after raw Py_Initialize and Py_Finalize.,3
3185,unittest.mock.patch: Double patching instance method: AttributeError: Mock object has no attribute '__name__',5
3186,inconsistent behavior concerning multiprocessing.manager.BaseManager._Server,5
3187,ProactorEventLoop doesn't support stdin/stdout nor files with connect_read_pipe/connect_write_pipe,5
3189,Document PyUnicode_* API,6
3190,Update Python 3 extension module porting guide,6
3191,CPython doesn't work when you disable refcounting,5
3192,ItemsView.__contains__ does not mimic dict_items,5
3193,Change weird behavior of PyModule_AddObject(),6
3194,The Python process stops responding immediately after starting,5
3195,Allow doctest to deep copy globals,6
3196,input() call blocks multiprocessing,5
3197,mmap.mmap.__iter__ is broken (yields bytes instead of ints),6
3198,Clarify bytes vs text with non-seeking tarfile stream,5
3199,ctypes.util.find_library should examine binary's RPATH on Solaris,6
3200,Unclear language (the word ineffective) in the documentation for os.walk,6
3201,Default ConfigParser in python is not able to load values habing percent in them,2
3202,"Inconsistent environment in Windows using ""Open With""",5
3203,Interpreter fails in initialize on systems where HAVE_LANGINFO_H is undefined,1
3204,Dialect class defaults are not documented.,5
3205,Separate built-in types from functions and group similar functions in functions.rst,6
3206,returning ctypes._SimpleCData objects from callbacks,5
3208,Cookie.py does not correctly quote Morsels,5
3209,Apparent memory leak in PC/bdist_wininst/install.c,5
3210,"Make argparse.SUPPRESS work as an argument ""dest""",6
3211,CDLL does not use same paths as util.find_library,5
3212,Tk DPI awareness,6
3213,asyncio.iscoroutinefunction returns unexpected results when presented with unittest.mock.Mock,5
3214,http.client header debug output format,5
3215,File mode wb+ appears as rb+,5
3217,Add advice about non-ASCII wsgiref PATH_INFO,5
3218,Distutils-based installer does not detect 64bit versions of Python,5
3219,time.strptime not thread safe,1
3221,_ProactorReadPipeTransport pause_reading()/resume_reading() broken if called before any read is perfored,5
3222,CoverageResult fails to merge input file with non-empty callers in trace.py,5
3223,trace CLI doesn't respect -s option,5
3225,syslog logging handler fails with address in unix abstract namespace,5
3226,Suspect test.test_codeccallbacks.test_mutatingdecodehandler,6
3228,inconsistent garbage collector behavior across platforms when using ctypes data-structures,5
3229,urlparse.parse_qs should take argument for query separator,6
3230,pathlib inheritance diagram too large,6
3231,"skipitem() in getargs.c still supports 'w' and 'w#', and shouldn't",5
3232,clarifying Availability: Unix,6
3233,SpooledTemporaryFile doesn't correctly preserve data for text (non-binary) SpooledTemporaryFile objects when Unicode characters are written,5
3234,Having a shlex example in the subprocess.Popen docs is confusing,6
3235,curframe can be None in pdb.py,1
3236,shutil.move fails to move symlink (Invalid cross-device link),5
3237,msvcrt_putch/msvcrt_putwch don't check the return value of _putch/_putwch,5
3238,Inconsistant error messages for failed attribute modification,6
3239,bdist_msi package duplicates everything to a bogus location when run with /passive or /q,5
3240,EINTR handling in fcntl,5
3241,Elide Py_atomic fences when WITH_THREAD is disabled?,7
3243,list.index does not accept None as start or stop,5
3245,Obmalloc lock LOCK_INIT and LOCK_FINI are never used,5
3246,Mingw-w64 and python on windows x64,2
3248,PyBytes_FromObject accepts arbitrary iterable,5
3249,"Exception ignored in: <module 'threading' from ...threading.py> in _shutdown, assert tlock.locked()",5
3250,implement PEP 3118 struct changes,6
3251,subprocess on windows leaks stdout/stderr handle to child process when stdout/stderr overridden,3
3252,tarfile: accessing (listing and extracting) tarball fails with UnicodeDecodeError,5
3253,Add native enum support for argparse,6
3254,bdist_rpm fails due to wrong hardcoded assumption about RPM filename format,5
3255,"distutils : file ""bdist_rpm.py"" does not quote filenames when executing the rpm command",5
3257,logging.Handler.handleError should be called from logging.Handler.handle,5
3258,make pdb.set_trace() accept debugger commands as arguments and run them after entering the debugger,6
3259,Incomplete Internationalization in Argparse Module,5
3260,Document magic methods called by built-in functions,6
3261,Serialize dict with non-string keys to JSON  unexpected result,5
3262,RFC6266 support (Content-Disposition for HTTP),6
3263,Adding a recvexactly() to socket.socket: receive exactly n bytes,6
3264,cleanup temporary files in distutils.has_function,6
3265,json.dump() ignores its 'default' option when serializing dictionary keys,5
3266,Plistlib fails on certain valid plist values,5
3267,plistlib fails to parse bplist with 0x80 UID values,5
3268,Socket state corrupts when original socket object goes out of scope in a different thread,5
3269,Documentation for int constructor mentions __int__ but not __trunc__,6
3270,tkFileDialog crash on askopenfilename Python 2.7 64-bit Win7,1
3271,pyvenv: activate.fish breaks $PATH for bash scripts,5
3272,Incorporating float.is_integer into the numeric tower and Decimal,6
3274,Disasembler fall with Key Error while disassemble obfuscated code.,5
3275,"argparse required arguments displayed under ""optional arguments""",6
3276,shutil.which wrong result on Windows,5
3277,hashlib: add a method to hash the content of a file,6
3278,missing meta-info in documentation pdf,5
3279,Allow built-in module in package,6
3280,test_os fails when run on Windows ramdisk,5
3281,asyncio _UnixWritePipeTransport._close abandons unflushed writes,5
3282,multiprocessing behavior combining daemon with non-daemon children inconsistent with threading,5
3283,"Mixing multiprocessing pool and subprocess may create zombie process, and cause program to hang.",5
3285,Deprecate register_adapter() and register_converter() in sqlite3,6
3286,csv.reader Error message indicates to use deprecated,5
3287,_pyio.BufferedReader and _pyio.TextIOWrapper destructor don't emit ResourceWarning if the file is not closed,3
3288,faulthandler_user should use _PyThreadState_Current,5
3289,Need an ability to build standard DLLs with distutils,6
3290,argparse: 'resolve' conflict handler damages the actions of the parent parser,5
3291,test_dbm_gnu,1
3292,Re: Allow Path.relative_to() to accept non-ancestor paths,6
3294,Document how to cite Python,6
3295,ICC compiler: ICC treats denormal floating point numbers as 0.0,1
3296,pyclbr module needs to be more flexible on loader support,5
3297,Support for read()/write()/select() on asyncio,6
3298,inspect.getclosurevars returns incorrect variable when using class member with the same name as other variable,5
3299,Problem with testembed make dependencies in certain circumstances,2
3300,ctypes.util.find_library() should return full pathname instead of filename in linux,6
3301,unittest.mock does not wrap dunder methods (__getitem__ etc),5
3302,unittest subTest failure causes result to be omitted from listing,5
3303,Replacement for unittest.mock.mock_open,6
3304,Support subinterpreters in the GIL state API,6
3305,Make the PyGILState API compatible with multiple interpreters,6
3306,Documents input/output effects of how IDLE runs user code,6
3307,unittest load_tests protocol not working as documented,5
3308,unittest ignores the first ctrl-c when it shouldn't,5
3309,Failing ensure_future still creates a Task,5
3311,Inconsistency concerning nested scopes,6
3312,mingw: configure MACHDEP and platform for build,6
3313,mingw: translate gcc internal defines to python platform specific defines,6
3315,pkgutil.walk_packages returns extra modules,5
3316,Add stop_after parameter to setup(),6
3317,KeyboardInterrupt while in input() not catchable on Windows 10,5
3318,frozen executables should have an empty path,6
3319,"argparse with required field , not having new line separator in -help dispaly",5
3320,"mingw: Allow Objects/exceptions.c to include ""errmap.h""",6
3321,expose glossary link on hover,5
3322,CGI library - Using unicode in header fields,5
3324,Crash in installer,1
3325,Crash calling sqlite3_close with invalid pointer,1
3327,Unhandled exception (TypeError) with ftplib in function retrbinary/retrlines causes inoperable behavior without crashing,5
3328,Serialize array.array to JSON by default,6
3329,Add open_file_descriptor parameter to fcntl.lockf() (use the new F_OFD_SETLK flag),6
3331,Bad formatting in WinError 193 when using subprocess.check_call,6
3332,Incorrect operand precedence when implementing sequences in C,5
3333,Unchecked return value of I/O functions,5
3334,Result type depends on order of operands for bytes and bytearray,5
3335,distutils --record option does not validate existence of byte-compiled files,5
3336,Windows: subprocess.Popen: race condition for leaking inheritable handles,5
3338,add a flag that will not give the set a sys.stdin,6
3339,datetime.strptime without a year fails on Feb 29,6
3341,issue with PYTHON_FOR_BUILD,2
3342,cross-compilation of Python3.4,2
3343,Wrong line number attributed to comprehension expressions,5
3344,Backport of #17086 causes regression in setup.py,2
3346,csv.writer.writerows masks exceptions from __iter__,6
3347,ctypes.create_string_buffer does not add NUL if len(init) == size,5
3348,Mark __del__ not being called in cycles as an impl detail,5
3349,MINGW: install import library,6
3351,Windows frozen .exe multiprocessing.Queue access is denied exception,5
3352,Message.get_filename produces exception if the RFC2231 encoding is ill-formed,5
3353,add support string that are not inherited from PyStringObject,5
3356,Garbage collection of unused input sections from CPython binaries,7
3358,Add partial.kwargs,6
3361,Tkinter root window won't close if packed.,5
3362,'TypeError: object of type 'NoneType' has no len()' in 'splitdrive',2
3363,Python quits on running tkinter code with threads,5
3364,"Deadlock in thread.join on Python 2.7/Mac OS X 10.9, 10.10",5
3365,Python 2.7.10 and 3.4.4 hang on imaplib.IMAP4_SSL(),5
3366,Catch FileNotFoundError in socketserver.DatagramRequestHandler,5
3367,SocketServer.DatagramRequestHandler with empty response,5
3368,Tkinter dialogs will not close if root window not packed.,5
3369,"""incompatible pointer type"" while compiling Python3.5.1",5
3370,Crash in Tokenizer - Heap-use-after-free,1
3371,tcpserver should document non-threaded long-living connections,6
3372,zlib decompress as_bytearray flag,6
3373,tarfile can't add in memory files (reopened),6
3374,listen socket close in SocketServer.ForkingMixIn.process_request(),5
3375,"Deadlock in logging caused by a possible race condition with ""format""",1
3376,concurrent_futures Executor.map semantics better specified in docs,6
3377,Add 'geo' URI scheme (RFC 5870) to urllib.parse.uses_params,6
3378,shelve filename inconsistent between platforms,6
3379,time.strftime('%z') didn't make +HHMM return in windows xp,5
3382,sys.setprofile / sys.getprofile asymetry,5
3383,"suggestion for os.kill(pid,CTRL_C_EVENT) in tests",5
3384,3.5.1 installer issue on Win 7 32 bit,5
3385,Build Problem with GCC + Macintosh OS X 10.11 El Capitain,2
3386,OSError 17 due to _multiprocessing/semaphore.c assuming a one-to-one Pid -> process mapping.,5
3387,"Named entity ""vertical line"" missed in 2.7 htmlentitydefs.py",5
3388,multiprocessing.dummy.Queue does not expose same interface as multiprocessing.Queue,6
3389,Deprecate os.kill() on Windows,5
3391,multiprocessing.util._afterfork_registry leak in threaded environment,3
3393,tabulary entries in PDF documentation,5
3394,PDF documentation: long verbatim lines are cut off at right hand side,5
3395,textwrap should minimize number of breaks in extra long words,6
3397,Bypass imghdr module determines the type of image,5
3398,shutil._copyxattr() function shouldn't fail if setting security.selinux xattr fails,5
3399,DIfference between utf8 and utf-8 when i define python source code encoding.,5
3400,Solaris 10 build issues,2
3401,socketserver can't stop,5
3402,Calling SocketServer.shutdown() when server_forever() was not called will hang,5
3403,IDLE should start with HOME as the initial working directory,6
3404,concurrent.futures: add ScheduledExecutor,6
3406,Make subclassing SocketServer simpler for non-blocking frameworks,6
3407,Idle: timed autosave for shell (and maybe editor) window,6
3408,Change os.access to check ACLs under Windows,6
3409,TestProgram is mentioned in the unittest docs but is not documented,6
3410,http.cookies: Handle malformed cookie,6
3411,BaseCookie does not complain if a non RFC compliant cookie header was given,5
3412,Add support of copy protocol to zlib compressors and decompressors,6
3413,shutil.copyfile should internally use os.sendfile when possible,6
3414,extension built with a shared python cannot be loaded with a static python,6
3416,"""unpacked"" bytecode",6
3417,Shared execution context between doctests in a module,6
3418,Clean up turtle.py code formatting,6
3420,Allow zipapp to target modules,6
3421,BaseTransport.close() does not trigger connection_lost(),5
3422,Inconsistent behaviour of PEP 3101 formatting between versions,5
3423,zipimport is not PEP 3147 or PEP 488 compliant,5
3424,Make number serialization ES6/V8 compatible,6
3425,Deprecate the zlib decompressors flush() method,6
3427,zipfile.ZipFile.write() does not accept bytes arcname,5
3428,"platform.system() should be ""macosx"" instead of ""Darwin"" on OSX",5
3429,replacing obj.__dict__ with a subclass of dict,5
3430,zipfile.ZipInfo slots can raise unexpected AttributeError,5
3431,run runtktests.py error when test tkinter,5
3432,New misleading wording in execution model documenation,6
3434,Python with ncurses6.0 will not load _curses module on Solaris 10,2
3436,urllib2 initiate irregular call to gethostbyaddr,7
3437,argparse: mutually exclusive groups full of help-suppressed args can cause AssertionErrors,5
3438,Some test_ssl network tests fail if svn.python.org is not accessible.,5
3439,HTTPResponse.close() should consume all remaining data in body if any,6
3440,Tutorial incorrectly claims that (explicit) relative imports don't work in the main module,5
3441,xxlimited/xxmodule docstrings ambiguous,6
3442,"socket, PEP 383: Mishandling of non-ASCII bytes in host/domain names",5
3443,Printing: No print dialog or page setup,6
3446,Append system paths in setup.py instead of prepending,5
3447,inspect.iscoroutinefunction raises TypeError when checks Mock of function or coroutinefunction,5
3448,python3 k1om dissociation permanence: readelf,2
3449,python3 k1om dissociation permanence: libffi,2
3450,test_pkg test_4 and/or test_7 sometimes fail,5
3451,optparse: various problems with unicode and gettext,5
3452,"xmlrpclib methods submit call on __str__, __repr__",5
3453,Limiting data copy in xmlrpclib,3
3455,ISO-2022 seeking forgets state,5
3456,optimize compilation options,7
3457,PyImport_GetModuleDict: no module dictionary! when `__del__` triggers a warning,1
3458,Unsafe to BaseEventLoop.set_debug(False) when PYTHONASYNCIODEBUG=1,5
3459,shlex.quote and pipes.quote do not quote shell keywords,5
3460,HTTPPasswordMgrWithPriorAuth does not work with DigestAuthentication,6
3461,asyncore asynchat hanging on ssl,1
3462,regression in pdb output between 2.7 and 3.5,5
3464,pulldom.DOMEventStream.__getitem__ is broken,5
3465,pulldom.PullDOM doesn't populate DOM tree,5
3466,ElementTree and minidom don't prevent creation of not well-formed XML,6
3467,pulldom doesn't provide END_DOCUMENT or COMMENT nodes.,5
3468,ConfigParser.get() doc to be updated according to the configparser.py header doc,6
3469,Raise ImportWarning when loader.load_module() is used,5
3471,zipfile: symlinks etc.,6
3473,"On Windows, os.scandir will keep a handle on the directory until the iterator is exhausted",5
3474,__package__ not set to None under pdb in Python 3,5
3475,Reference leaks in test_smtplib,3
3476,Expose Py_TPFLAGS_ values from Python,6
3477,ftplib.sendcmd only accepts string,5
3478,zipfile cannot handle zip files where the archive size for a file does not match actual contents,5
3479,"sockaddr_l2 lacks CID, address type (AF_BLUETOOTH sockets)",5
3480,Deprecate threading.Thread.isDaemon etc,6
3481,__qualname__ different when calling generator object w/ functions.partial,5
3483,bdist_rpm should support %config(noreplace),6
3484,re.compile() repr end quote truncated,5
3485,test_shutil fails when gid name is missing,5
3486,http.client PUT method ignores error responses sent immediatly after headers,5
