,title,type
4472,HCI Bluetooth socket bind error on an arm crosscompiled environment,5
4473,XMLRPCLIB Exception uses str not class or instance,1
4475,Hardcoded namespace_separator in the cElementTree.XMLParser,6
4476,python-2.7.3-r3: crash in visit_decref(),1
4479,test_win32 fails on aarch64,1
4480,XPath Support in ElementTree doc omission,6
4481,glob.glob inconsistent,5
4482,urlparse - relative url parsing and joins to be RFC3986 compliance,6
4483,printf %qd is nonstandard,5
4484,freeze.py not working properly with OS X framework builds,6
4487,Errors in documentation of standard codec error handlers,6
4488,sys.argv contains only scriptname,5
4489,Key presses are doubled in Tkinter dialog invoked from window close handler with Cocoa Tk,5
4491,pkgutil.find_loader raises an ImportError on PEP 420 implicit namespace packages,1
4492,selectors: towards uniform EBADF handling,6
4493,datetime.strftime('%s') does not take timezone into account,5
4494,Thread.LockType is misnamed,5
4495,"When adding .PY and .PYW to PATHEXT, it replaced string instead of appending",5
4497,Incorrect evaluation order of function arguments with *args,5
4498,time.time can return NaN,5
4499,distutils.LooseVersion fails to compare number and a word,5
4500,Optimize marshal format and add version token.,6
4501,io.BufferedReader.peek(): Documentation differs from Implementation,5
4502,Deprecate addinfourl getters,6
4504,Nonblocking serial io using Arduino and Ubuntu 14.10 (Python 3.4.2) performance slowdown,7
4505,Incorrect description of descriptor invocation in Python Language Reference,6
4507,please add wsgi to SimpleXMLRPCServer,6
4509,"Enable 'imageop' - ""Multimedia Srvices Feature module"" for 64-bit platform",6
4510,add thai encoding aliases to encodings.aliases,6
4511,[Windows] asyncio: add UDP support to ProactorEventLoop,6
4513,altinstall should not install libpython3.so (conflict between multiple $VERSIONs),5
4514,namedtuple row factory for sqlite3,6
4515,multiprocessing maxtasksperchild=1 + logging = task loss,5
4516,hackcheck is broken in association with __setattr__,5
4517,quopri_codec newline handling,5
4519,"Clean up quopri, correct method names encodestring and decodestring",5
4520,shelve.open/bsddb.hashopen exception with unicode paths,5
4521,webbrowser doesn't respect xfce default browser,5
4522,inspect.getsource() returns incorrect source lines,5
4523,BufferedIncrementalEncoder violates IncrementalEncoder interface,5
4524,Reimplement subset of multiprocessing.sharedctypes using memoryview,6
4525,http.server failed to decode '+' to ' ' when calling cgi script/executable in window,5
4526,Add an 'offset' argument to zlib.decompress,6
4527,codecs.StreamWriter.reset contract not fulfilled,5
4528,Tools/unicode/gencodec.py error,5
4529,Building external modules using Sun Studio 12,2
4530,IDLE grep/find/replace source code needs docstrings,6
4531,multiprocessing doc organization impedes understanding,6
4532,Unit test needed for IDLE's GrepDialog.py's findfiles(),6
4533,sqlite3 Row can return duplicate keys when using adapters,5
4534,sqlite3 converter not being called,5
4535,Sorting with locale (strxfrm) does not work properly with Python3 on BSD or OS X,5
4536,Add tests for CLI of the tabnanny module,6
4537,MozillaCookieJar does not handle session cookies,5
4538,Update tix install information in tkinter tix chapter of doc,5
4540,socket.recvfrom(0) waits for data,5
4541,xmlrpc.client.ServerProxy needs timeout parameter,6
4542,Add timeout parameter to Queue.join(),6
4543,collections.abc sequences don't check identity before equality,5
4544,Improved support for prepared SQL statements,6
4545,"""pydoc filter"" documentation restrictive",6
4546,pyvenv should display a progress indicator while creating an environment,6
4547,Rename Scripts directory to bin and move python.exe to bin,6
4548,pip.exe breaks if python 2.7.9 is installed under c:\Program Files\Python,1
4549,unittest expectedFailure could take a message argument like skip does,6
4550,patch: steer people away from codecs.open,5
4551,Integration of unittest.FunctionTestCase with automatic discovery and loading,6
4552,Change necessary in platform.py to support IronPython,5
4553,Alternate RFC 3986 compliant URI parsing module,6
4554,Document PyCFunction_New and PyCFunction_NewEx functions,6
4555,doctest work with Windows PyReadline,6
4556,mailbox: other programs' messages can vanish without trace,5
4557,difflib.SequenceMatcher and Match: code and doc bugs,5
4558,mailbox module doesn't support compressed mbox,6
4559,Single-line option to pygettext.py,6
4560,redirected cookies,5
4562,Setup & Usage documentation for selected stdlib modules,6
4563,mailbox (2.5b1): locking doesn't work (esp. on FreeBSD),5
4564,missing termios constants,6
4565,Cookie.BaseCookie has ambiguous unicode handling,5
4566,%-formatting and dicts,5
4569,"In imaplib, cached capabilities may be out of date after login",6
4570,Idle extension configuration and key bindings,6
4571,installation order of 32bit and 64bit python seems to matter,5
4573,document the special features (eg: fdclose=False) of the standard streams,5
4574,Add example of using load_tests to parameterise Test Cases,6
4575,Get path to shell/known folders on Windows,6
4576,cmd module should sort misc help topics,6
4577,pathlib relative_to() can give confusing error message,5
4578,"aifc should use str instead of bytes (wave, sunau compatibility)",5
4579,os.path.normcase documentation confusing,5
4580,Add a way to determine if the current thread has the import lock,6
4582,RFC 2387 (multipart/related) in email package,6
4583,tarfile raises an exception when reading an empty tar in streaming mode,5
4584,urlretreive locks up in 2.7.8,5
4585,Add Japanese legacy encodings,6
4586,string.printable.isprintable() returns False,5
4588,include a codec to handle escaping only control characters but not any others,6
4589,os.confstr() does not handle value changing length between calls,5
4590,"when ""python -c command"" does a traceback, it open the file ""<string>""",5
4591,sysconfig generation uses some env variables multiple times,5
4592,CEnvironmentVariableTests and PyEnvironmentVariableTests test the same implementation,5
4594,Compact output for regrtest,6
4595,cgi.py multipart/form-data,7
4596,Richer stat object,6
4597,RuntimeError: settrace/setprofile function gets lost,5
4599,test_gdb leaves the terminal in raw mode with gdb 7.8.1,5
4600,Number ABC can be instantiated,5
4601,bdist installation dialog,6
4602,cgitb html: wrong encoding for utf-8,5
4604,Cannot override JSON encoding of basic type subclasses,5
4605,mention explicitly that stdlib assumes gmtime(0) epoch is 1970,5
4606,"IDLE - add ""paste code"" functionality",6
4607,Timeout making ajax calls to SimpleHTTPServer from internet explorer,5
4609,argparse.FileType.__call__ returns unwrapped sys.stdin and stdout,5
4611,email.Header no encoding of unicode strings containing newlines,5
4612,Case sensitivity problem in multiprocessing.,5
4613,Nested namespace imports do not work inside zip archives,5
4614,pydoc.synopsis fails to load binary modules,5
4615,test_pydoc test_synopsis_sourceless is a flaky test,5
4616,"""make altinstall && make install"" behaviour differs from ""make install""",5
4617,unittest TestProgram hard to extend,6
4619,"warn_dir is always true for install_data, even if an install_dir is specified",5
4620,"PyArg_ParseTuple 2.X docs mention int for ""t#"", but ""Py_ssize_t"" for ""w#"", etc.",5
4621,pickletools.OpcodeInfo.code is a string,5
4622,Increased test coverage for uu and telnet,6
4623,bz2.BZ2File.read() does not treat growing input file properly,5
4624,PyStructSequence_NewType() not setting proper heap allocation flag?,1
4625,SimpleCookie Generates Non-RFC6265-Compliant Cookies,5
4626,sgmllib.parse_endtag() is not respecting quoted text,5
4628,Document Linux packages you need to compile Python with all dependencies,6
4629,TestProgram leaves defaultTestLoader.errors dirty,5
4630,ip_interface can't be broadcast or number net,5
4633,doc error: 6.2.4. Match Objects,5
4634,unittest.TestProgram.usageExit no longer invoked,5
4635,textwrap.wrap: add control for fonts with different character widths,6
4636,csv writer with blank lineterminator breaks quoting,5
4637,"The decode_header() function decodes raw part to bytes or str, depending on encoded part",5
4638,getpass returns garbage when typing tilde on Windows with deadkeys,5
4639,pathlib: iterfiles() and iterdirs(),6
4640,Compress the marshalled data in PYC files,6
4641,xmlapp.py display bug when validate XML by DTD,5
4642,document (lack of) interaction between @expectedException on a test_method and setUp,5
4643,unexpected successes are not output,5
4644,TestProgram loading fails when a script is used,5
4646,urljoin should raise a TypeError if URL is not a string,5
4647,Custom order for the subcommands of build,6
4648,urllib2 localnet Changed test to lookup IP-address of localhost,5
4649,Document lack of support for keyword arguments in C functions,5
4650,Reorganize unittest.mock docs into linear manner,6
4651,unittest.mock: use slots in MagicMock to reduce memory footprint,3
4652,"add an optional ""default"" argument to tokenize.detect_encoding",6
4654,Python 3.4.2 Windows installer - cannot install 32 bit then 64 bit version,5
4655,test.test_pathlib.PosixPathTest.test_touch_common fails on FreeBSD with ZFS,5
4658,"An OSError subclass for ""no space left on device"" would be nice: NoSpaceError",6
4659,object lifetime fragility in unittest tests,5
4660,bdist_msi upload fails,5
4661,PyType_Ready doesn't ensure that all bases are ready,6
4662,Add encodings of supported in glibc locales,6
4663,unittest: unhelpful truncating of long strings.,5
4664,str.isspace should use the Unicode White_Space property,5
4665,Python does not support the GEORGIAN-PS charset,1
4666,External.bat and pcbuild of tkinter do not match.,5
4667,Specify supported XML version,6
4669,"On FreeBSD, signal.NSIG is smaller than biggest signal value",5
4670,Idle extension configuration: add option-help option,6
4671,Obscure error w/ windows online-only file,6
4672,target of 'import statement' entry in general index for 'i' is wrong,6
4673,re.finditer and re.findall should support negative end positions,6
4674,Review extension enable options,6
4676,Posix getenv makes no guarantee of lifetime of returned string,1
4678,Inconsistency between Python 2 and PyPy regarding future imports,5
4679,list duplicate test names with patchcheck,6
4680,Idle: update htest.py and htests,5
4681,unittest needs more flush calls,5
4683,give more meaningful argument names in argparse documentation,6
4684,datetime module should use int32_t for date/time components,6
4685,Add silent mode for py_compile,6
4686,distutils always ignores byte compilation errors,5
4687,Make rawiobase_read() read directly to bytes object,7
4688,memoryview: add multi-dimensional indexing and slicing,6
4689,memoryview bind (the opposite of release),6
4690,ctypes: better support of bytearray objects,6
4691,test_capi.test_no_FatalError_infinite_loop crash on Windows,1
4692,Rounding properly,5
4693,Format string for ASCII unicode or bytes-like object as readonly buffer,6
4694,float related test has problem with Denormal Flush to Zero compiler options,5
4695,fma documentation should provide better example.,6
4696,Use __attribute__(cleanup ...) to detect refleaks,6
4698,Comparison of memoryview,6
4699,PyOS_mystricmp is broken,5
4700,Decimal module flags undetermined when a signal is trapped.,5
4701,"PEP 3121, 384 Refactoring applied to xx module",3
4702,Make bytes() use tp_as_buffer for cmp,6
4704,Review and document string format accepted in numeric data type constructors,6
4705,"PEP 3121, 384 Refactoring applied to struct module",3
4706,Allow using decimals as arguments to `timedelta`,6
4707,"expat ParseFile expects bytes, not string",5
4708,Indicating packages to be loaded when a Tcl interpreter is created in tkinter,6
4709,"containers ""same"" does not always mean ""__eq__"".",6
4710,"Windows: build with ""build_pgo.bat -2"" fails to optimize python.dll",2
4711,urllib.parse.parse_qsl different results after urllib.parse.unquote,5
4712,Allow connecting AST nodes with corresponding source ranges,6
4713,Idle/tkinter ~x.py 'save as' fails. closes idle,5
4715,Unicodedata module should provide access to codepoint aliases,6
4716,Add os.path.isrelative() and improve ntpath.isabs(),6
4718,"UTF-7 codec decodes ill-formed sequences starting with ""+""",5
4719,argparser's subparsers.add_parser() should accept an ArgumentParser,6
4720,Misc tarfile fixes,5
4721,Automate update of doc references to UCD version when it changes.,6
4723,Make PyUnicode_AsWideCharString() increase temporary,6
4724,local variable changes lost after pdb jump command,5
4725,urllib.FancyURLopener does not treat URL fragments correctly,5
4726,shutil to support equivalent of: rm -f /dir/*,6
4727,Add 'unexpected_type' to TypeError,6
4728,subprocess.py doesn't correctly detect Windows machines,5
4729,_Pickler_New() doesn't call PyObject_GC_Track(self),5
4730,Remove unnecessarily random behavior from test_unparse.py,5
4731,make profile-opt fails with pre-existing python2.7 in path,5
4732,mmap.resize changes memory address of mmap'd region,6
4733,gettext() cannot find translations with plural forms,5
4734,Tkinter Variables require a proper master,5
4735,wsgiref.simple_server.SimpleServer claims to be multithreaded,5
4738,libainstall doesn't create $(BINDIR) directory,2
4739,doc: ctypes no need to explicitly allocate writable memory with Structure,6
4740,MacOSX: Building 2.7 without the xcode command line  tools installed,2
4741,access to cdecimal / libmpdec API,6
4742,Concurrent.futures base concurrency improvement (with patch),6
4743,sysconfig and alternative implementations,5
4744,Remove required metadata warnings for sdist,6
4745,_pickle build warnings on Fedora 19,2
4746,create_unicode_buffer() fails on non-BMP strings on Windows,5
4747,ET: add custom namespaces to serialization methods,6
4748,Updating _fields_ of a derived struct type yields a bad cif,1
4749,urllib2 cannnot handle https and BasicAuth via Proxy.,1
4750,duplicate test name in Lib/test/test_heapq.py,5
4751,TEST_DATA_DIR for out-of-tree builds,5
4752,"Add a dedicated specification for module ""reloading"" to the language reference",6
4753,"pydoc.py doesn't detect IronPython, help(foo) can hang",1
4754,Truncated POST data in CGI script on Windows 7,5
4755,Unchecked PyErr_WarnPy3k return value in Objects/typeobject.c,5
4756,ERROR: SystemError: ./../Objects/tupleobject.c:118: bad argument to internal function,5
4757,can't compile with clang and build a shared lib due to libffi,2
4758,Relax the type restriction on reloaded modules,6
4759,Provide Tcl/Tk linkage information for extension module builds,6
4761,"minidom replaceChild(new_child, old_child) removes new_child even if in another document",5
4762,IDLE crashes on *Edit / Find in files ...* command,5
4764,AbstractBasicAuthHandler,5
4765,AIX locale parsing failure,5
4766,json iterencode can not handle general iterators,6
4767,turtledemo two_canvases reversion,5
4768,headerregistry.Address introduces extra quotes without addr_spec parameter,5
4770,missing afxres.h error when building bdist_wininst in Visual Studio 2008 Express,2
4772,code.InteractiveInterpreter fails to change locals when invoked in a function,5
4773,Allow use of > 256 FD's on solaris in 32 bit mode,6
4774,OSErrors should use str and not repr on paths,5
4775,duplicate test names in Lib/ctypes/test/test_functions.py,5
4776,expanding platform module and making it work as it should,6
4777,[Py3k] SyntaxError cursor shifted if multibyte character is in line.,5
4778,re.sub[n] doesn't seem to handle /Z replacements correctly in all cases,5
4782,Undocumented KeyError from os.path.expanduser,5
4783,__base__ undocumented,6
4784,write tilted text in turtle,6
4786,test.support method for dual-testing accelerated code (fixes test_exceptions and other's pickle testing),6
4787,bdist_wininst doesn't clean up read-only files in build dir,5
4788,Fail when vsvarsall.bat produces stderr,6
4789,Autoconf tests in python not portably correct,2
4790,import + coding = failure (3.1.2/win32),5
4791,add remove_argument_group to argparse,6
4792,urllib2 post error when using httpproxy,5
4793,"urllib2 - Basic,Digest Proxy Auth Handlers failure will give 401 code instead of 407",5
4794,--install-base not honored on win32,5
4795,2to3 zip fixer doesn't fix for loops.,5
4796,nis module not supporting group aliases,6
4797,Signal stack overflow in faulthandler_user,3
4798,configparser can't parse MySQL style config,6
4799,Add discussion of trailing backslash in raw string to tutorial,6
4800,"configure doesn't find ""major()"" on HP-UX v11.31",2
4801,urllib2 fails against IIS (urllib2 can't parse 401 reply www-authenticate headers),1
4802,Inconsistent README filenames,6
4803,memoryview: expose 'buf' attribute,6
4804,Integrate ElementC14N module into xml.etree package,6
4805,A tp_dealloc of a subclassed class cannot resurrect an object,6
4806,imghdr doesn't recognize variant jpeg formats,6
4807,No explanation of how a task gets destroyed in asyncio 'task' documentation,5
4808,Fix wsgiref handling of absolute HTTP Request-URI,5
4810,Support Unicode line boundaries in regular expression,6
4811,The function cygwinccompiler.is_cygwingcc leads to FileNotFoundError under Windows 7,5
4812,"asyncio task chapter confusion about 'task', 'future', and 'schedule'",5
4813,Argparse considers unknown optional arguments with spaces as a known positional argument,5
4814,os.getenv() not updated after external module uses C putenv(),5
4815,Adding the opposite function of shlex.split(),6
4816,2to3 import fixer writes dotted_as_names into import_as_names,5
4817,Not all attributes of the console for a subprocess with creationflags=0 are inherited,5
4818,test_logging test_race failed with PermissionError,5
4819,Turtle Circle Speed 0,5
4820,ipaddress.py new IPv6 Method for Solicited Multicast Address,6
4821,urllib2.urlopen().read().splitlines() opening a directory in a FTP server randomly returns incorrect result,5
4822,inconsistent results with inspect.getsource / .getsourcelines,5
4823,resolve() on Windows makes some pathological paths unusable,5
4824,Making tempfile.NamedTemporaryFile a class,6
4825,Allow site.addsitedir insert to beginning of sys.path,6
4826,Difflib should provide the option of overriding the SequenceMatcher,6
4827,Command to display all available Import Library,6
4828,2to3 fix_renames doesn't rename string.lowercase/uppercase/letters,5
4830,running a suite with no tests is not an error,6
4831,Tkdnd mouse cursor handling patch,6
4832,Ability to join() threads in concurrent.futures.ThreadPoolExecutor,6
4835,Add a datatype to represent mime types to the email module,6
4836,hotshot.stats.load fails with AssertionError,5
4837,pyconfig.h is not placed in --includedir,5
4838,Add support for reading records with arbitrary separators to the standard IO stack,6
4839,can't specify newline string for readline for binary files,6
4840,Turtledemo: stop reloading demos,5
4841,Add capsule API to _decimal,6
4842,Convoy effect with I/O bound threads and New GIL,7
4843,intcatcher() can deadlock,5
4844,modulefinder fails if module contains syntax error,5
4845,"Add a ""decode to declared encoding"" version of urlopen to urllib",6
4846,distutils/spawn.py handle fork() not implemented.,6
4847,Report actual EOF character instead of assuming Ctrl-D,6
4848,Make PYLONG_BITS_IN_DIGIT always available to non-core extensions,6
4849,FAIL: test_longdouble (ctypes.test.test_callbacks.Callbacks) [SPARC/64-bit],5
4850,doctest _load_testfile function -- newline handling seems incorrect,5
4852,"multiprocessing example ""pool of http servers "" fails on windows",5
4853,pathlib glob ignores trailing slash in pattern,5
4854,Write better test for SSLContext.load_verify_locations,6
4855,asynchat's handle_error inconsistency,5
4856,Make subprocess handling text output with universal_newlines more obious,6
4857,int() docstring - unclear what number is,6
4858,ipaddress module accepts octal formatted IPv4 addresses in IPv6 addresses,5
4859,webbrowser.py add parameters to suppress output on stdout and stderr,6
4860,read() vs read1() in asyncio.StreamReader documentation,5
4861,Add a resource for CLI tests,6
4862,Update or remove claims that distutils requires external programs,6
4863,Make pyvenv style virtual environments easier to configure when embedding Python,6
4864,"Rearrange tkinter tests, use test discovery",6
4865,Wave.py support for ulaw and alaw audio,6
4866,shutil copy* unsafe on POSIX - they preserve setuid/setgit bits,4
4867,Run Tkinter tests with wantobjects=False,6
4868,argparse: positional arguments containing - in name not handled well,5
4869,ast.parse gives wrong position (col_offset) for some BinOp-s,5
4870,ERROR: test_no_optimize_flag on Mageia Linux Cauldron x86-64 with certain configure flags,5
4871,Add to shutil the ability to wait until files are definitely deleted,6
4872,Improve display of OS exception <-> errno mapping,6
4873,argparse not including '--' arguments in previous optional REMAINDER argument,5
4874,wsgiref doesn't appear to ever set REMOTE_HOST in the environ,5
4875,ZipFile.writestr writes incorrect extended local headers,5
4876,pathlib.PurePath.parents rejects negative indexes,5
4877,Make it easy to replace print() calls with logging calls,6
4878,"disallow the ""surrogatepass"" handler for non utf-* encodings",6
4879,pdb-run-restarting-a-pdb-session,5
4880,Add pathlib.chown method,6
4881,"filecmp.cmp's ""shallow"" option",5
4882,Add a section to Windows FAQ explaining os.symlink,5
4883,unittest warnings counter,6
4884,stack smash when using ctypes/libffi to access union,1
4885,Make install find the build_base directory,5
4886,find_executable fails to find .bat files on win32,5
4887,Use argparse in the uu module,6
4888,move doctest test-data files into a subdirectory of Lib/test,6
4889,"add ""Name Collision"" section to argparse docs",6
4890,"argparse: subparsers, argument abbreviations and ambiguous option",5
4891,The -t option has no effect in for uu command-line,6
4893,3.3 : test_argparse.py fails 'make test',5
4894,Incomplete Python LDFLAGS and CPPFLAGS used for extension modules on posix,5
4895,Should not release GIL while running RegEnumValue,1
4896,distutils is silent about multiple -I/-L/-R,6
4897,TarFile.getmember on directory requires trailing slash iff over 100 chars,5
4899,Strict aliasing violations in Objects/unicodeobject.c,5
4900,unable to disable -r in run_tests.py,5
4901,Add alias for iso-8859-8-i which is the same as iso-8859-8,6
4902,turtle with compound shape doesn't get clicks,5
4903,is(upper/lower/title) are not exactly correct,6
4904,"Buid issues on Cygwin - _curses, _curses_panel, and _io",2
4905,mingw: setup msvcrt and _winapi modules,6
4906,mingw: ignore main program for frozen scripts,6
4907,mingw: use main() to start execution,6
4908,mingw: nt thread model detection,6
4909,Add a configure option for performance guided optimization,6
4910,Mac: Some Python Launcher issues,5
4911,Static Windows Build fails to locate existing installation,5
4912,Make re match object iterable,6
4913,argparse - CSS white-space: like control for individual text blocks,6
4914,test failures on KFreeBSD,5
4915,Make Turtle thread-safe so it does not crash,6
4916,fix_import (2to3 fixer) is not case-sensitive,5
4917,bdist_wininst uninstaller does not remove pycache directories,5
4918,distutils compiler not handling spaces in path to output/src files,5
4919,Buffer overflow when listing deeply nested directory,5
4920,mimetypes read from the registry should not overwrite standard mime mappings,5
4921,Compiling vim with Python 3.3 support fails,2
4922,_winreg.QueryValue fault while reading mangled registry values,5
4923,scriptsinstall target fails in alternate build dir,5
4924,Zipfile generates Zipfile error in zip with 0 total number of disk in Zip64 end of central directory locator,5
4925,os.path.normcase gets fooled on windows with mapped linux network drive,5
4926,Wrong Paths for distutils build --plat-name=win-amd64,5
4927,bdist_wininst builds wrongly for --plat-name=win-amd64,5
4928,--install-base option ignored?,5
4930,'python -u' yields trailing carriage return '\r'  (Python2 for Windows),5
4931,Patch: optimize code to use LIST_APPEND instead of calling list.append,6
4932,os.walk() consider some symlinks as dirs instead of non-dirs,6
4934,"TextIOWrapper(newline=""\n"", line_buffering=True) mistakenly treat \r as a newline",5
4935,Mac installer need not add things to /usr/local,6
4936,Python make issue,5
4937,Use the _functools module to speed up functools.total_ordering,7
4938,Would like Py_Initialize to play friendly with host app,6
4939,Solaris ctypes_test failures,5
4940,argparse: terminal width is not detected properly,6
4941,2.7: test_threading hangs on Solaris 9,2
4942,Merge super() guide into documentation,6
4943,webbrowser.get(command_line) does not support Windows-style path separators,5
4944,KeyboardInterrupt during Thread.join hangs that Thread,5
4945,inconsistency in list-generator comprehension with yield(-from),5
4946,Add at least minimal support for thread groups,6
4947,Make CPython test package discoverable,5
4948,_sysconfigdata broken with universal builds on OSX,5
4949,Logger.findCaller needs to be smarter,6
4951,cgitb failures,5
4952,Test harness unnecessarily disambiguating twice,6
4953,Potential Bug in errors.c,5
4954,Provide a 'print' action for argparse,6
4955,pdb raises BdbQuit on 'quit' when started with set_trace,5
4957,bdist_rpm fails when installing man pages,5
4958,distutils: clean does not use build_base option from build,5
4959,concurrent.futures.as_completed() installs waiters for already completed Futures,7
4962,unittest mock create_autospec doesn't correctly replace mocksignature,5
4963,multiprocessing.dummy.Pool does not accept maxtasksperchild argument,5
