,title,type
1520,"Tkinter.PanedWindow: docstring fixes, change in paneconfigure and removed some returns",5
1521,IDLE: startup problem when HOME does not exist,5
1522,distutils extra_link_args not working because it is added to cmd last. should before -llibs,5
1523,col_offset is -1 and lineno is wrong for multiline string expressions,6
1524,IDLE functional/integration testing,6
1525,test_readline hangs,5
1527,IDLE: Improve configuration tests with mock Save.,6
1529,possibe typo in json/scanner.py,6
1530,unittest.TestResult.addSubTest should be called immediately after subtest finishes,5
1531,idle3 shell os.system swallows shell command output,5
1534,Can't use proxy to connect internet on windows,5
1535,Linking with 'ld -b' fails with 64-bit using Itanium HP compiler,2
1536,"python cannot import module located on a ""VOLUME"" directory",5
1537,"asyncio: selector_events: add_urgent() for urgent data to read, 3rd argument of select.select()",6
1539,Rewrite PyUnicode_AsWideChar() and PyUnicode_AsWideCharString(),3
1541,"inspect.getsource only works for objects loaded from files, not interactive session",5
1542,"Contrary to documentation, relative imports cannot pass through the top level",5
1543,Larger and/or configurable _MAX_LENGTH for unittest messages,6
1544,Idle: Improve htests,6
1545,AttributeError when parsing multipart email with invalid non-decodable Content-Transfer-Encoding,5
1546,Normalise non-ASCII variable names in __all__,5
1547,Deadlock in multiprocessing.pool.Pool on terminate,5
1548,_PyObject_GC_UNTRACK corruption when call a lambda function with C API,1
1549,Refactor IDLE htest,6
1550,[2.7] test_weakref hangs on Python 2.7 on Windows,5
1551,multiprocessing.dummy missing cpu_count,5
1552,win_add2path.py sets wrong user path,5
1553,Tutorial and  FAQ: how to call a method on an int,5
1554,"Use ""Low-fragmentation Heap"" memory allocator on Windows",7
1555,"UnloadUserprofile displays the error ""The handle is invalid""",5
1557,IDLE: modernize textview module,6
1558,Document that subprocess.Popen does not set PWD,6
1559,"IDLE: in shell, time.sleep ignores _thread.interrupt_main()",5
1560,"Aliasing import of sub-{module,package} from the package raises AttributeError on import.",5
1562,"Fix referencing of built-in types (list, int, ...)",6
1563,email.contentmanager.raw_data_manager fails to create multipart messages,5
1564,misleading return from isidentifier,5
1565,IDLE opens partially hidden,5
1566,IDLE - remove all bare excepts,5
1567,IDLE applies syntax highlighting to user input in its shell,5
1568,IDLE and pythonw.exe stderr problem,5
1569,IDLE: make interactive code savable as a runnable script,6
1570,IDLE save keyboard shortcut problem,5
1571,IDLE - ParenMatch fails to find closing paren of multi-line statements,5
1572,IDLE: Changed Shortcuts don't show up in menu,5
1573,IDLE uses common tkinter variables across all editor windows,6
1574,"Possibility of setting custom key bindings for ""Additional help sources"" menu items",6
1575,IDLE: Detect Python files even if name doesn't end in .py,6
1576,IDLE file-completion is case-sensitive in Windows,6
1577,IDLE: Document SaveAs extension display on Mac,5
1578,Finish IDLE Query dialog appearance and behavior.,5
1580,IDLE - standardize dialogs,6
1581,Tk  occasionally mispositions Text() insert cursor on mouse click.,5
1582,IDLE: Replace selected not working/consistent with find,5
1583,IDLE settings dialog shouldn't be modal,6
1585,Idle: highlite tabs,6
1586,"IDLE: inconsistent use of HOMEDRIVE, HOMEPATH, and USERPROFILE on Windows",5
1587,IDLE: Patch to make PyShell behave more like a Terminal interface,5
1589,Idle: optionally auto-pop-up completion window for names,6
1590,"IDLE -s and (-, -c command, or -r file) produces error message",5
1591,Idle: stop depending on console output,5
1592,"Idle: some modal dialogs maximize, don't minimize",5
1594,Subclass of property doesn't preserve instance __doc__ when using doc= argument,5
1595,Integrate tkinter and asyncio (and async),6
1596,zlib.compressobj took too much memory on window,3
1597,Add roadmap.txt section to idlelib,6
1598,json dump fails for mixed-type keys when sort_keys is specified,5
1599,Add contextlib.convert_exception manager,6
1601,Deprecation warnings building 3.5 Visual Studio Windows 8.1 64 bit,2
1602,asyncio: support multiprocessing (support fork),5
1603,Multiprocessing Send to Manager Fails for Large Payload,6
1604,Allow incremental I/O to blobs in sqlite3,6
1605,Symlink to directory on Windows 8,5
1606,ntpath.realpath() should use GetFinalPathNameByHandle(),6
1607,Option --executable for entry_points,5
1608,bdb and pdb: Add watchpoint function,6
1609,urllib does not support NO_PROXY environment variable containing domain with asterisk,6
1610,decimal: Use FASTCALL and/or Argument Clinic,7
1611,"Redesign Help => About IDLE, make it non-modal",5
1612,"test_nntplib: sporadic failures, network isses? server down?",5
1613,async generator receives wrong value when shared between coroutines,5
1614,getaddrinfo emulation does not support AI_NUMERICSERV,5
1615,getaddrinfo invalid port number,5
1616,getaddrinfo raises OverflowError,5
1617,textwrap.dedent mishandles empty lines,5
1618,textwrap.dedent doesn't work properly with strings containing CRLF,5
1619,RuntimeError caused by lazy imports in pdb,5
1620,list_repr not safe against concurrent mutation,1
1621,Make CHECK_STATUS_PTHREAD signal-safe,5
1622,"pyinstaller can be added to docs, py2exe ref can be updated",6
1623,ttk: GUI tests fail on Ubuntu,5
1624,locale.getdefaultlocale() fails on Mac OS X with default language set to English,5
1625,"putenv() accepts names containing '=', return value of unsetenv() not checked",5
1626,IDLE: Display entry errors for key sequence entry in entry box,6
1627,Upgrade tuples in socket to named tuple like,6
1629,Implement utf-8-bmp codec,5
1630,IDLE's F5 Run Module doesn't transfer effects of future import,5
1631,Idle: conflict between loop execution and undo shortcut.,5
1632,turtle.py and turtledemo use the default tkinter icon,6
1633,IDLE: Set correct WM_CLASS on X11,5
1634,Can IDLE's query box be improved,6
1635,test_normalization doesn't work,5
1636,idle editor: replace all in selection,6
1637,IDLE - same menubar across application,6
1638,IDLE removes elements from tracebacks.,5
1639,IDLE - tabbing in a string always brings up file completion window,5
1640,Ensure that IDLE's stdlib imports are from the stdlib,5
1643,Hang in lib/test/test_threading.py,5
1644,IDLE configdialog: reduce multiple references to Var names,6
1645,Command-line arguments when running in IDLE,6
1646,Failing tests with installed 3.6.2rc1 on Win 10-64,5
1647,"Update Index for set, dict, and generator 'comprehensions'",5
1648,IDLE: Add keyboard equivalents for mouse actions.,5
1649,ZipFile.open treats directory path as empty file,5
1651,IDLE: Make PyShell visible upon error.,6
1652,Idle: run from editor without explicit save,6
1653,Save on Close windows (IDLE),5
1654,"On linux, numeric pad input is ignored when numlock off",6
1655,IDLE: Warn user about overwriting a file that has a newer version on filesystem,6
1656,test_local.TestEnUSCollection failures on Solaris 10,5
1657,Idle: scroll Text faster with mouse wheel,6
1658,New command line option supported by unittest.main() for running initialization code before tests,6
1659,pass big values for arg to fcntl.ioctl,5
1660,"Incorrect description of ""async with"" in PEP492 and documentation",5
1661,Clarify kwarg handing for subprocess convenience APIs,6
1662,IDLE HOWTO,6
1663,Idle: enhance FormatParagraph,6
1664,Idle options dialog: add help,6
1666,Idle: test startup scripts.,6
1667,Idle: updata fixwordbreaks() for unicode identifiers,6
1668,IDLE: Improve Mock_Text,6
1669,Idle: hilite search terms in hits in Find in Files output window,6
1670,Improve IDLE news handling,6
1671,Idle: better management of Shell window output,6
1672,Idle: add better access to extension information,6
1673,"Setup & Usage documentation for pydoc, IDLE, & 2to3",6
1674,Fix idlelib.PyShell.build_subprocess_arglist  use of __import__,5
1675,IDLE: debugger local/global vars should not be editable,5
1676,IDLE - file list improvements,6
1677,IDLE - infrastructure changes so editors don't assume they're in a toplevel,6
1678,"IDLE: Mac OS X pressing ctrl-A in Python shell moved cursor before the prompt, which then makes the keyboard unresponsive.",5
1679,IDLE: add current directory to open_module,5
1680,Idle: Add 'find all' in current file,6
1681,Update doc for Idle command line options.,5
1682,Idle: improve idle.html help viewer.,6
1683,Idle: refine right-click behavior,6
1684,IDLE: warn if save-as name matches stdlib name,6
1685,IDLE shows traceback when printing non-BMP character,5
1686,IDLE: Saving Shell should not add \n,5
1687,Idle: __future__ does not work in startup code.,5
1688,IDLE: Cleanup config code,6
1689,IDLE:Make help source menu entries unique and sorted.,5
1690,"IDLE: Switch search dialogs to ttk widgets, and other refinement",6
1691,"IDLE: Remove '', user_dir, and idlelib from sys.path when added",5
1692,"IDLE completions: format, factor, and fix",5
1693,fileinput inplace clobbers file without leaving backup on decode errors,5
1694,Make shutil.make_archive have deterministic sorting,6
1695,zipfile raises wrong exception for some incorrect passwords,5
1696,inspect.getsource(obj.foo) fails when foo is an injected method constructed from another method,6
1697,IDLE - TreeWidget draw and double-click (Ubuntu),5
1698,os.symlink: FileExistsError shows wrong message,5
1699,Clarify copyreg.pickle() documentation,5
1700,cPickle.loads is not thread safe due to non-thread-safe imports,5
1702,Automatic upcast does not occur for custom classes,5
1703,"Documentation is unclear how ""y*"" and ""y#"" format units vary",5
1704,"urlparse, urlsplit confused when password includes fragment (#), query (?)",5
1705,IDLE: revise doc subsection 'Completions',6
1706,Widget variable binding does not work if mainloop is called from a different function,5
1707,PyStructSequence_NewType is broken; makes GC type without setting Py_TPFLAGS_HEAPTYPE,1
1709,textwrap should treat Unicode em-dash like ASCII em-dash,6
1711,Enhance documentation of os.mkdir(),6
1712,Python does not provide PyLong_FromIntMax_t() or PyLong_FromUintMax_t() function,6
1713,IDLE: Add test_autocomplete unittest,6
1714,(FreeBSD/OSX) Fix fcntl module to accept 'unsigned long' type commands for ioctl(2).,5
1716,Race condition in shutil.copyfile(),4
1717,IDLE: add tests for autocomplete window.,6
1718,POSIX capabilities support,6
1719,DOC: missing word in license.rst,6
1720,[Cygwin] multiprocessing module with pool object issue,5
1721,IDLE shell shouldn't use TABs,5
1722,IDLE: Add lineno sidebar to editor window,6
1723,Optimize calling type slots,7
1724,"Improve IDLE's  ""subprocess didn't make connection"" message",6
1725,Support tarfile.PAX_FORMAT in shutil.make_archive,6
1726,Make IDLE tests less flashy,6
1727,sqlite3 executescript does not respect isolation_level?,5
1728,signal module always overwrites SIGINT on interpreter shutdown,5
1729,Add integer formatting code for fixed-width signed arithmetic (2's complement),6
1731,samefile and sameopenfile fail for WebDAV mapped drives,5
1732,Derby #17: Convert 49 sites to Argument Clinic across 13 files,6
1733,Import command-line parsing modules only when needed,6
1735,"test_time fails: strftime('%Y', y) for negative year",5
1736,shlex.shlex should not augment wordchars,5
1737,IDLE: add tests for help_about.py,6
1738,sync-up gammavariate and expovariate code,7
1739,Unusual Windows registry path syntax,6
1740,ctypes: pass by value for structs broken on Cygwin/MinGW 64-bit,5
1741,issubclass segfaults on objects with weird __getattr__,1
1742,Distutils register command creates non-standard multipart data,5
1743,ndbm can't iterate through values on OS X,5
1744,"test_os.test_chown() failure on koobs-freebsd-{current,9}",5
1745,IDLE: Reduce number and time for user process imports,6
1746,pydoc help (or help('help')) should show the doc for help,5
1747,Idle Editor: Bottom Scroll Bar,6
1748,py.exe ignored PATH when using python3 shebang,5
1749,Encode to EBCDIC doesn't take into account conversion table irregularities,5
1752,Add the --duplicate option for timeit,6
1753,Eliminate implicit __main__ relative imports,6
1754,c_bool type not supported for BigEndianStructure on little-endian machine,2
1755,IDLE: Add navigate bar and replace current goto dialog,6
1757,Misleading example in sys.set_coroutine_wrapper docs,6
1758,pyexpat.errors wrongly bound to message strings instead of message codes,5
1759,urllib.unquote decodes percent-escapes with Latin-1,5
1760,datetime hash is deterministic in some cases,4
1763,NamedTemporaryFile does not generate a ResourceWarning for unclosed files (unlike TemporaryFile),5
1767,_io._WindowsConsoleIO breaks in the face of fd redirection,5
1768,urllib2 doesn't escape spaces in http requests,5
1769,Explicitly note that meta_path is not empty,5
1770,wsgi.simple_server's wsgi.input read/readline waits forever in certain circumstances,5
1771,asyncio.wait very slow with FIRST_COMPLETED,7
1772,Performance of typing._ProtocolMeta._get_protocol_attrs and isinstance,7
1773,email parseaddr and formataddr should be IDNA aware,6
1774,missing feature in inspect module: getmembers_static,6
1775,Add support for symlinks to zipfile,6
1776,Document order-preserving dictionary output in json,6
1777,multiprocessing.Pool shouldn't hang forever if a worker process dies unexpectedly,6
1778,Document cgitb.text and cgitb.html,6
1780,libgcc_s.so.1 must be installed for pthread_cancel to work,1
1781,Allow inspecting buffering attribute of IO objects,6
1782,IDLE: replace uses of tkinter simpledialog with query.Query,5
1783,Add daemon argument to Timer,6
1784,Add doc for tkinter commondialog.Dialog and subclasses,6
1785,IDLE restarts when one debugs code raising SystemExit,5
1788,getrusage returns platform-dependent value,5
1789,xdrlib.Packer().pack_fstring throws a TypeError when called with a str(),5
1790,Have argparse provide ability to require a fallback value be present,6
1792,Increase coverage of base64,6
1793,input function truncates prompt by NULL byte,5
1794,"socket.getservbyname(), socket.getservbyport(), socket.getprotobyname() are not threadsafe",5
1795,"Add ""necessarily inclusive"" groups to argparse",6
1796,"Element.findall(path, dict) doesn't insert null namespace",6
1797,ceval: Optimize list[int] (subscript) operation similarly to CPython 2.7,7
1798,improve asyncio debugging,6
1800,IDLE Debugger should handle interrupts,5
1801,PyList_SET_ITEM  could be safer,6
1802,Add fnmatch.filterfalse function,6
1803,file opened for updating cannot write after read,5
1805,Inconsistent Execution of Generic Descriptor Attributes,5
1806,README.valgrind should mention --with-valgrind,6
1807,Bring Windows docs up to date,6
1808,Documentation for argparse interactive use,6
1811,Move fields relevant to sys.exc_info out of frame into	generator/threadstate,6
1812,Don't support the PEP384 stable ABI in pydebug builds,5
1813,Documentation either unclear or incorrect on comparisons between bytes and strings in Python 3,5
1814,build.bat: register binaries for py launcher,6
1815,minidom: AttributeError: DocumentFragment instance has no attribute 'writexml',6
1817,isinstance checks in os.path.normcase redundant with os.fspath,7
1818,ipaddress: Wrong behavior with ::ffff:1.2.3.4 style IPs,5
1819,Confusion between asserts and Py_DEBUG,1
1821,open().write() fails on 2 GB+ data (OS X),5
1824,mailbox.MMDF wrongly adds From_ header to file,5
1825,Group the docs of similar methods in stdtypes.rst,6
1826,Python 3.6.1 (32-bit)_20170522020736.log,1
1827,mailbox : add option to prevent platform EOL conversion,6
1828,Bdb: Update doc page,6
1830,Documentation for sys.stdout encoding does not reflect the new Windows behavior in Python 3.6+,5
1831,IDLE to provide option for making trailing whitespace visible,6
1833,"fnmatch, glob: Allow curly brace expansion",6
1834,cgitb sends a bogus HTTP header if the app crashes before finishing headers,5
1836,Inconsistency in the zlib module,6
1837,Change script_helper to use universal_newlines=True in _assert_python,6
1838,Cannot build CPython3.6 with module testcapimodule statically,2
1839,Use __attribute__((deprecated)) to warn usage of deprecated functions and macros,6
1840,Make win_add2path.py take effect without having to log off,5
1841,AIA chasing for missing intermediate certificates on TLS connections,6
1843,"Distutils blows up with an incorrect pypirc, should be caught",5
1845,Bdb: add docstrings,6
1846,Correct the parsing of a test case docstring.,6
1847,"multiprocessing Array create for ctypes.c_char, TypeError unless 1 char string arg used",5
1849,iso6937 encoding missing,6
1851,Isolated mode doesn't ignore PYTHONHASHSEED,5
1853,Don't expose sqlite3 Cache and Statement,5
1854,Allow helper functions to wrap sys.setprofile,6
1855,webbrowser.open outputs xdg-open deprecation warning,5
1856,NamedTemporaryFile with delete=True should not fail if file already deleted,5
1857,Argparser does not display closing parentheses in nested mutex groups,5
1858,Subclassed json.JSONEncoder does not respect default method for supported types,5
1859,Teach IDLE to Autocomplete dictionary keys,6
1860,IDLE freezes when opening a file with astral characters,5
1861,sock_dealloc() may call __repr__ when socket class is already collected by GC,1
1862,Vague wording of pkgutil.walk_packages parameter 'prefix',5
1863,cpython and Clang Static Analyzer,6
1865,collections.UserString.__rmod__() raises NameError,5
1866,"tarfile.extractfile in ""r|"" stream mode fails with filenames or members from getmembers()",5
1867,locale.resetlocale is broken,5
1868,Provide a way to check for *real* typing.Union instances,6
1869,imaplib noop Debug,1
1870,Support the buffer protocol in json.loads(),6
1871,Add/check os.PathLike support for the tempfile module's 'dir' arguments,6
1872,"In SocketServer, why not passing a factory instance for the RequestHandlerClass  instead of the class itself?",5
1873,Implementation of IMAP IDLE in imaplib?,6
1875,dreadful performance in difflib: ndiff and HtmlDiff,6
1877,"Why are custom messages for ValueError, TypeError suppressed in argparse?",6
1878,Harmonizing descriptor protocol documentation,6
1879,Regex object should have introspection methods,6
1881,Configuration system does not work for Windows/Visual Studio,6
1882,2to3 doesn't detect or fix Exception indexing,6
1883,object returned by tarfile.extractfile has an incorrect value of name attribute,5
1884,Remove sqlite3.Cache display method,6
1886,"The element div#sidebar on documentation requires the attribute role=""button"".",6
1888,Make sqlite3 statement cache optional,6
1892,improve struct.unpack_from's error message like struct.pack_into,6
1893,Emit a ResourceWarning in concurrent.futures executor destructors,3
1894,Access violation due to CancelSynchronousIo of console read,1
1895,"Validate shutil supports path-like objects, update docs accordingly",5
1896,test_ssl.py is broken in Centos7,2
1898,Modernize make_ssl_certs,6
1899,Provide a way to compare AST nodes for equality recursively,6
1900,Approved API for creating a temporary file path,5
1902,Carry comments with the AST,6
1903,"bdist_wininst depends on MBCS codec, unavailable on non-Windows",5
1905,readline memory corruption when sys.stdin fd >= FD_SETSIZE for select(),1
1906,Tkinter extention modules have no documentation,6
1907,No Documentation on tkinter dnd module,6
1908,Add fileinput.islastline(),6
1909,Add ability to get/set tzinfo on datetime instances in C API,6
1911,AttributeError in Popen.communicate(),5
1912,tempfile.TemporaryDirectory fails to delete itself,5
1914,Add socket.fdtype(),6
1915,distutils build_ext: don't run newer_group() in parallel in multiple threads when using parallel,7
1916,unittest cannot load module whose name starts with Unicode,5
1917,make doctest in CPython has failures,5
1918,AST literal_eval exceptions provide no information about line number,6
1919,site.main() does not work on Python 3.6 and superior if PYTHONSTARTUP is set,5
1921,collections.abc.Reversible doesn't fully support the reversing protocol,5
1923,Testing FTP support in urllib shouldn't use Debian FTP server,5
1924,Add _PyTuple_Empty and make PyTuple_New(0) never failing,6
1926,subprocess.run with stderr connected to a pipe won't timeout when killing a never-ending shell commanad,5
1927,repr() of ImportError misses keyword arguments name and path,6
1929,Race condition in use of _PyOS_SigintEvent on windows,5
1931,Change in re.escape output is not documented in whatsnew,5
1933,Add a profile decorator to profile and cProfile,6
1934,python -m cProfile -s fails with non informative message,5
1935,BytesWarning is missing from the documents,6
1936,Integer overflow in wrap_lenfunc() on 64-bit build of Windows with len > 2**31-1,5
1937,Document test.support.script_helper,6
1938,functools.partialmethod should look more like what it's impersonating.,6
1940,array.array is not an instance of collections.MutableSequence,6
1941,Crash on Py_Finalize if Py_NoSiteFlag is used,1
1944,Use argparse in the profile/cProfile modules,6
1945,urllib2 works slowly with proxy on windows,7
1946,Duplicated connection_made() call for some SSL connections,5
1947,Update Tools/freeze to use .vcxproj files,5
1948,argparse: add ability to create a man page,6
1949,Duck-typing inspect.isfunction(),6
1950,csv: Inconsistency re QUOTE_NONNUMERIC,5
1951,Lib2to3 fails with unreadable pickle file,5
1952,PDB enhancement,6
1953,CPython hangs on error __context__ set to the error itself,5
1954,Opcode names BUILD_MAP_UNPACK_WITH_CALL and BUILD_TUPLE_UNPACK_WITH_CALL are too long,6
1955,Pdb sometimes crashes when trying to remove a breakpoint defined in a different debugger sessoon,5
1956,Doctest documentation unclear about multi-line fixtures,6
1957,new empty dict can be more small,3
1958,mailbox.Maildir doesn't create subdir structure when create=True and base dir exists,5
1959,Automatic Unload of Dynamic Library Cause Segfault,1
1960,Support Apple AIFF-C pseudo compression in aifc.py,6
1962,mailbox.MH chokes on directories without .mh_sequences,6
1963,Explain why it is recommended to pass args as a string rather than as a sequence If shell is True,6
1964,Custom functions in sqlite receive None on invalid UTF-8,5
1965,httplib/http.client in method _tunnel used HTTP/1.0 CONNECT method,5
1966,re.sub confusion between count and flags args,6
1967,"shutil.copystat should (allow to) copy ownership, and other attributes",6
1969,SQLite error code not exposed to python,6
1970,Use sqlite3 extended error codes,6
1971,"BaseSelectorEventLoop.sock_{recv,sendall}() don't remove their callbacks when canceled",5
1972,Problems building with --enable-profiling on macOS,2
1973,signal module ignores external signal changes,5
1974,Adding bytes.frombuffer(byteslike) constructor,6
1975,Datetime NoneType after calling Py_Finalize and Py_Initialize,5
1977,sum() several times slower on Python 3 64-bit,7
1978,PyCode_Optimize() (peephole optimizer) doesn't handle KeyboardInterrupt correctly,1
1979,argparse: choices override metavar,5
1980,Minor warning messages when compiling documentation,2
1981,"Add ""metavar"" argument to add_subparsers() in argparse",6
1982,Argumentless super() fails in classes constructed with type(),5
1983,Deadlocks in `concurrent.futures.ProcessPoolExecutor`,5
1984,urllib.urlretrieve() fails on second ftp transfer,5
1986,Documentation error: Descriptors,6
1988,Please do not log during shutdown,5
1989,Pickling and copying exceptions doesn't preserve non-__dict__ attributes,5
1990,Minor change to https://docs.python.org/3.6/extending/building.html,5
1992,Suggested changes for https://docs.python.org/3.6/extending/extending.html,5
1994,Improve tkinter 'import *' situation,5
1996,make install doesn't seem to support --quiet,6
1998,About function renaming in the tutorial,6
1999,Reference TOC: expand 'Atoms' and 'Primaries',6
2000,Lock.acquire() not interruptible on Windows,6
2001,%z directive has no effect on the output of time.strptime,5
2002,itertools.chain behaves strangly when copied with copy.copy,5
2004,Generate PC/python3.def by scraping headers,6
2005,Special method lookup fails on uninitialized types,5
2007,webbrowser module broken with Firefox 36+,5
2008,setup.py: do not add system header locations when cross compiling,2
2009,Expose max_queue_size in ThreadPoolExecutor,6
2010,webbrowser.open incomplete on Windows,5
2011,Class __dict__ is only a mapping proxy,5
2012,bdist_msi does not pass -install/remove flags to install_script,5
2013,Add follow_wrapped=True option to help(),6
2014,"argparse support for ""python -m module"" in help",6
2016,hypot define in pyconfig.h clashes with g++'s cmath,2
2017,argparse mutex group should allow mandatory parameters,6
2018,tempfile.NamedTemporaryFile: automatic cleanup by OS,5
2019,tabnanny unit tests,6
2020,create_subprocess_exec doc doesn't match software,5
2021,zlib missing when --enable--optimizations option appended,5
2022,gdb/libpython.py does not work with gdb 7.2,5
2023,deprecate shutil.copy2,6
2024,Add multibyte encoding support to pyexpat,6
2025,collections.deque should ship with a stdlib json serializer,6
2026,types.coroutine monkey patches original function,5
2027,Inconsistency between quopri.decodestring() and email.quoprimime.decode(),5
2028,pathlib is_reserved fails for some reserved paths on Windows,5
2029,"Docstrings of non-data descriptors ""ignored""",5
2030,msgfmt cannot cope with BOM,5
2031,Enhance Cmd support for docstrings and document it.,6
2032,Add callback parameter to concurrent.futures.Executor.map,6
2033,urllib.request.Request accepts but doesn't check bytes headers,5
2035,Mismatch between glibc and X11 locale.alias,5
2036,Derby #18: Convert 31 sites to Argument Clinic across 23 files,6
2037,errors raised by bytes() and bytearray() for invalid size argument,6
